{
    "$schema": "../schema.json",
    "id": "Incline_Push-Up_Close-Grip",
    "name": "Incline Push-Up Close-Grip",
    "muscles": {
        "primary": "triceps",
        "secondary": ["chest", "shoulders"]
    },
    "equipment": ["bodyweight"],
    "mechanic": "compound",
    "level": "beginner",
    "steps": [
        "Stand facing a Smith machine bar or sturdy elevated platform at an appropriate height.",
        "Place your hands next to one another on the bar.",
        "Position your feet back from the bar with arms and body straight. This will be your starting position.",
        "Keeping your body straight, lower your chest to the bar by bending the arms.",
        "Return to the starting position by extending the elbows, pressing yourself back up."
    ]
}
