{
    "$schema": "../schema.json",
    "id": "Reverse_Crunch",
    "name": "Reverse Crunch",
    "muscles": {
        "primary": "abs",
        "secondary": []
    },
    "equipment": ["bodyweight"],
    "mechanic": "isolation",
    "level": "beginner",
    "steps": [
        "Lie down on the floor with your legs fully extended and arms to the side of your torso with the palms on the floor. Your arms should be stationary for the entire exercise.",
        "Move your legs up so that your thighs are perpendicular to the floor and feet are together and parallel to the floor. This is the starting position.",
        "While inhaling, move your legs towards the torso as you roll your pelvis backwards and you raise your hips off the floor. At the end of this movement your knees will be touching your chest.",
        "Hold the contraction for a second and move your legs back to the starting position while exhaling.",
        "Repeat for the recommended amount of repetitions."
    ],
    "source": {
        "name": "free-exercise-db",
        "id": "Reverse_Crunch"
    }
}
