{
    "$schema": "../schema.json",
    "id": "Two-Arm_Kettlebell_Jerk",
    "name": "Two-Arm Kettlebell Jerk",
    "muscles": {
        "primary": "shoulders",
        "secondary": ["calves", "quads", "triceps"]
    },
    "equipment": ["kettlebell"],
    "mechanic": "compound",
    "level": "intermediate",
    "steps": [
        "Clean two kettlebells to your shoulders.",
        "Clean the kettlebells to your shoulders by extending through the legs and hips as you swing the kettlebells towards your shoulders.",
        "Rotate your wrists as you do so, so that the palms face forward.",
        "Squat down a few inches and reverse the motion rapidly driving both kettlebells overhead.",
        "Immediately after the initial push, squat down again and get under the kettlebells.",
        "Once the kettlebells are locked out, stand upright to complete the exercise."
    ]
}
