{
    "$schema": "../schema.json",
    "id": "band-curl",
    "name": "Band curl",
    "muscles": {
        "primary": "biceps",
        "secondary": []
    },
    "equipment": ["band"],
    "mechanic": "isolation",
    "level": "beginner",
    "steps": [
        "Stand on the middle of the band with feet hip-width apart, holding an end in each hand, palms forward.",
        "Keep your elbows pinned to your sides and curl your hands up to your shoulders.",
        "Lower slowly until your arms are straight."
    ],
    "tips": ["Stand on the band, curl to the shoulders."]
}
